{
  "schema_version": 1,
  "project": {
    "name": "Rythme / Rhythm Exports",
    "repository": "anoopuri21/rythm"
  },
  "lifecycle": "paused",
  "authorization": {
    "through_phase": "17",
    "deployment_enabled": false
  },
  "git": {
    "branch": "rhythm-uat",
    "local_head": "f7c5a873b5b8dcf5387fa34769253b60ef5534c5",
    "remote_head": "f7c5a873b5b8dcf5387fa34769253b60ef5534c5",
    "working_tree_clean": true
  },
  "delivery": {
    "phase": "12",
    "chunk": "homepage-minor-ui-ux-plan",
    "task": "Homepage top bar, truthful offer loop and privacy-safe recent-purchase card",
    "status": "in_progress"
  },
  "execution": {
    "action_class": "idempotent_write",
    "attempt": 1,
    "max_attempts": 1,
    "last_verified_action": "Owner requested an immediate hold of Auto Mode and asked for a plan before code execution for homepage UI/UX changes. The plan records top bar, truthful 10–50% offer loop, privacy-safe recent-purchase card, required owner content inputs and responsive/test gates."
  },
  "agents": {
    "accountable": "Agent 0",
    "primary": [
      "Agent 3",
      "Agent 4",
      "Agent 6",
      "Agent 8",
      "Agent 13"
    ],
    "reviewers": [
      "Agent 9",
      "Agent 11"
    ]
  },
  "checkpoint": {
    "id": "c30c24a8b002c3479bc6c340872b0e4da2cf946a90d510206fe78d22eb4446eb",
    "created_at": "2026-08-30T12:50:24.201Z"
  },
  "decisions": [
    {
      "id": "AS-D001",
      "summary": "Use versioned repository checkpoints because Arena cannot run after a session closes.",
      "confidence": "high",
      "reversible": true
    },
    {
      "id": "AS-D002",
      "summary": "Use a dedicated homepage_category_rows relation rather than overloading HomepageBlock text fields.",
      "confidence": "high",
      "reversible": true
    },
    {
      "id": "AS-D003",
      "summary": "Owner explicitly activated Auto Mode for Phase 12 on 30 August 2026; execute canonical Phases 12–17 sequentially while preserving human gates and keeping Phase 18/deployment inactive.",
      "confidence": "high",
      "reversible": true
    },
    {
      "id": "AS-D004",
      "summary": "Add per-user/per-product five-attempt 60-second limits to authenticated review and product-question writes to reduce abuse without changing approved moderation or purchase rules.",
      "confidence": "high",
      "reversible": true
    },
    {
      "id": "AS-D005",
      "summary": "Harden customer input boundaries by requiring product-owned active variants for cart/order operations and active products for new wishlist writes.",
      "confidence": "high",
      "reversible": true
    },
    {
      "id": "AS-D006",
      "summary": "Pause Auto Mode at owner request and handle homepage UI/UX changes as a manual plan-first task; do not infer contact details or expose real customer purchase data.",
      "confidence": "high",
      "reversible": true
    }
  ],
  "risks": [
    {
      "id": "AS-R001",
      "severity": "high",
      "summary": "A delayed tool response could cause duplicate execution unless actual outcome is reconciled."
    }
  ],
  "blockers": [],
  "human_gates": [
    {
      "id": "AS-H001",
      "status": "closed",
      "summary": "Requirements and authority selections supplied by owner."
    },
    {
      "id": "AS-H002",
      "status": "closed",
      "summary": "Owner must run the documented non-destructive persistent MySQL import/admin review and provide exact imported/active totals for Phase 6A Chunk 3."
    },
    {
      "id": "AS-H003",
      "status": "closed",
      "summary": "Owner must run controlled Razorpay test-mode payment, replay, failure, full/partial refund and provider reconciliation scenarios without exposing credentials."
    },
    {
      "id": "AS-H004",
      "status": "closed",
      "summary": "Owner must verify controlled staging transactional email delivery, SPF/DKIM/DMARC status and HTML/plain-text rendering without sharing credentials."
    },
    {
      "id": "AS-H005",
      "status": "closed",
      "summary": "Owner runtime must run the non-destructive Phase 10 Chunk 1 migration plus focused/full tests because PHP and Composer are unavailable in Arena."
    },
    {
      "id": "AS-H006",
      "status": "closed",
      "summary": "Owner runtime must run focused refund and full regression tests before the paid-cancellation admin fix is accepted; no additional real/test refund should be submitted for qualification."
    },
    {
      "id": "AS-H007",
      "status": "closed",
      "summary": "Owner confirmed rythm.test now resolves to the rhythm_db MySQL database and cached configuration was cleared."
    },
    {
      "id": "AS-H008",
      "status": "closed",
      "summary": "Owner reported all Phase 10 qualification gates complete at 4a6c498; no returns/tax values or legal enablement was activated."
    },
    {
      "id": "AS-H009",
      "status": "closed",
      "summary": "Phase 11 owner-runtime, automated and rendered qualification accepted on 30 August 2026."
    },
    {
      "id": "AS-H010",
      "status": "open",
      "summary": "Owner requested a hold of Auto Mode for a manual homepage UI/UX plan-first task; implementation awaits required content/privacy choices."
    }
  ],
  "gate_results": [
    {
      "name": "Chunk 0 authority reconciliation",
      "outcome": "passed",
      "evidence": "tasks/AUTONOMOUS_SUPERVISOR_CHUNK_0_AUTHORITY.md",
      "verified_at": "2026-08-27T00:00:00.000Z"
    },
    {
      "name": "Chunk 1 state and checkpoint engine",
      "outcome": "passed",
      "evidence": "tasks/AUTONOMOUS_SUPERVISOR_CHUNK_1_STATE.md",
      "verified_at": "2026-08-27T11:39:23.014Z"
    },
    {
      "name": "Chunk 2 read-only auditor and planner",
      "outcome": "passed",
      "evidence": "tasks/AUTONOMOUS_SUPERVISOR_CHUNK_2_PLANNER.md",
      "verified_at": "2026-08-27T11:45:00.000Z"
    },
    {
      "name": "Chunk 3 risk-classified recovery",
      "outcome": "passed",
      "evidence": "tasks/AUTONOMOUS_SUPERVISOR_CHUNK_3_RECOVERY.md",
      "verified_at": "2026-08-27T12:00:00.000Z"
    },
    {
      "name": "Chunk 4 agent governance",
      "outcome": "passed",
      "evidence": "tasks/AUTONOMOUS_SUPERVISOR_CHUNK_4_AGENTS.md",
      "verified_at": "2026-08-27T12:15:00.000Z"
    },
    {
      "name": "Chunk 5 evidence gates",
      "outcome": "passed",
      "evidence": "tasks/AUTONOMOUS_SUPERVISOR_CHUNK_5_GATES.md",
      "verified_at": "2026-08-27T12:30:00.000Z"
    },
    {
      "name": "Chunk 6 bootstrap and resume",
      "outcome": "passed",
      "evidence": "tasks/AUTONOMOUS_SUPERVISOR_CHUNK_6_RUNBOOK.md",
      "verified_at": "2026-08-27T12:45:00.000Z"
    },
    {
      "name": "Chunk 7 integrated simulations",
      "outcome": "passed",
      "evidence": "tasks/AUTONOMOUS_SUPERVISOR_CHUNK_7_SIMULATION.md",
      "verified_at": "2026-08-27T13:00:00.000Z"
    },
    {
      "name": "Autonomous Supervisor activation review",
      "outcome": "passed",
      "evidence": "tasks/AUTONOMOUS_SUPERVISOR_CHUNK_8_ACTIVATION.md",
      "verified_at": "2026-08-27T13:15:00.000Z"
    },
    {
      "name": "Phase 6A Chunk 4.0 configuration",
      "outcome": "passed",
      "evidence": "tasks/PHASE_6A_CHUNK_4_0_CONFIGURATION.md",
      "verified_at": "2026-08-28T15:00:00.000Z"
    },
    {
      "name": "Phase 6A Chunk 4.1 bounded queries",
      "outcome": "passed",
      "evidence": "tasks/PHASE_6A_CHUNK_4_1_QUERIES.md",
      "verified_at": "2026-08-29T15:30:00.000Z"
    },
    {
      "name": "Phase 6A Chunk 4.2 Homepage presentation",
      "outcome": "passed",
      "evidence": "tasks/PHASE_6A_CHUNK_4_2_PRESENTATION.md",
      "verified_at": "2026-08-29T16:30:00.000Z"
    },
    {
      "name": "Phase 6A Chunk 4.3 Shop qualification",
      "outcome": "passed",
      "evidence": "tasks/PHASE_6A_CHUNK_4_3_SHOP_QA.md",
      "verified_at": "2026-08-29T17:15:00.000Z"
    },
    {
      "name": "Phase 6A persistent MySQL catalogue UAT",
      "outcome": "passed",
      "evidence": "tasks/PHASE_6A_CHUNK_3_IMPORT_REVIEW.md",
      "verified_at": "2026-08-29T17:45:00.000Z"
    },
    {
      "name": "Phase 8 Chunk 0 payment operations audit",
      "outcome": "passed",
      "evidence": "tasks/PHASE_8_PAYMENT_OPERATIONS_PLAN.md",
      "verified_at": "2026-08-29T18:15:00.000Z"
    },
    {
      "name": "Phase 8 Chunk 1 payment event ledger",
      "outcome": "passed",
      "evidence": "tasks/PHASE_8_CHUNK_1_PAYMENT_EVENTS.md",
      "verified_at": "2026-08-29T19:00:00.000Z"
    },
    {
      "name": "Phase 8 Chunk 2 safe payment retry",
      "outcome": "passed",
      "evidence": "tasks/PHASE_8_CHUNK_2_PAYMENT_RETRY.md",
      "verified_at": "2026-08-29T20:00:00.000Z"
    },
    {
      "name": "Phase 8 Chunk 3 refund operations",
      "outcome": "passed",
      "evidence": "tasks/PHASE_8_CHUNK_3_REFUNDS.md",
      "verified_at": "2026-08-29T21:00:00.000Z"
    },
    {
      "name": "Phase 8 Chunk 4 financial timelines and reconciliation",
      "outcome": "passed",
      "evidence": "tasks/PHASE_8_CHUNK_4_RECONCILIATION.md",
      "verified_at": "2026-08-29T22:00:00.000Z"
    },
    {
      "name": "Phase 8 Razorpay test-mode acceptance",
      "outcome": "passed",
      "evidence": "tasks/PHASE_8_PAYMENT_OPERATIONS_PLAN.md",
      "verified_at": "2026-08-29T22:30:00.000Z"
    },
    {
      "name": "Phase 9 Chunk 0 notification architecture audit",
      "outcome": "passed",
      "evidence": "tasks/PHASE_9_NOTIFICATION_ARCHITECTURE_PLAN.md",
      "verified_at": "2026-08-29T23:00:00.000Z"
    },
    {
      "name": "Phase 9 Chunk 1 durable notification domain",
      "outcome": "passed",
      "evidence": "tasks/PHASE_9_CHUNK_1_NOTIFICATION_DOMAIN.md",
      "verified_at": "2026-08-29T23:30:00.000Z"
    },
    {
      "name": "Phase 9 Chunk 2 central commerce notifications",
      "outcome": "passed",
      "evidence": "tasks/PHASE_9_CHUNK_2_COMMERCE_NOTIFICATIONS.md",